API,Description,Auth,Category,LinkLocalbitcoins,P2P platform to buy and sell Bitcoins,,Cryptocurrency,https://localbitcoins.com/api-docs/
Mempool,Bitcoin API Service focusing on the transaction fee,,Cryptocurrency,https://mempool.space/api
MercadoBitcoin,Brazilian Cryptocurrency Information,,Cryptocurrency,https://www.mercadobitcoin.com.br/api-doc/
Messari,Provides API endpoints for thousands of crypto assets,,Cryptocurrency,https://messari.io/api
Nexchange,Automated cryptocurrency exchange service,,Cryptocurrency,https://nexchange2.docs.apiary.io/
Nomics,Historical and realtime cryptocurrency prices and market data,apiKey,Cryptocurrency,https://nomics.com/docs/
NovaDax,"NovaDAX API to access all market data, trading management endpoints",apiKey,Cryptocurrency,https://doc.novadax.com/en-US/#introduction
OKEx,Cryptocurrency exchange based in Seychelles,apiKey,Cryptocurrency,https://www.okex.com/docs/
Poloniex,US based digital asset exchange,apiKey,Cryptocurrency,https://docs.poloniex.com
Solana JSON RPC,Provides various endpoints to interact with the Solana Blockchain,,Cryptocurrency,https://docs.solana.com/developing/clients/jsonrpc-api
Technical Analysis,Cryptocurrency prices and technical analysis,apiKey,Cryptocurrency,https://technical-analysis-api.com
VALR,Cryptocurrency Exchange based in South Africa,apiKey,Cryptocurrency,https://docs.valr.com/
WorldCoinIndex,Cryptocurrencies Prices,apiKey,Cryptocurrency,https://www.worldcoinindex.com/apiservice
ZMOK,Ethereum JSON RPC API and Web3 provider,,Cryptocurrency,https://zmok.io
1Forge,Forex currency market data,apiKey,Currency Exchange,https://1forge.com/forex-data-api/api-documentation
Amdoren,Free currency API with over 150 currencies,apiKey,Currency Exchange,https://www.amdoren.com/currency-api/
apilayer fixer.io,Exchange rates and currency conversion,apiKey,Currency Exchange,https://fixer.io
Bank of Russia,Exchange rates and currency conversion,,Currency Exchange,https://www.cbr.ru/development/SXML/
Currency-api,Free Currency Exchange Rates API with 150+ Currencies & No Rate Limits,,Currency Exchange,https://github.com/fawazahmed0/currency-api#readme
CurrencyFreaks,Provides current and historical currency exchange rates with free plan 1K requests/month,apiKey,Currency Exchange,https://currencyfreaks.com/
Currencylayer,Exchange rates and currency conversion,apiKey,Currency Exchange,https://currencylayer.com/documentation
CurrencyScoop,Real-time and historical currency rates JSON API,apiKey,Currency Exchange,https://currencyscoop.com/api-documentation
Czech National Bank,A collection of exchange rates,,Currency Exchange,https://www.cnb.cz/cs/financni_trhy/devizovy_trh/kurzy_devizoveho_trhu/denni_kurz.xml
Economia.Awesome,Portuguese free currency prices and conversion with no rate limits,,Currency Exchange,https://docs.awesomeapi.com.br/api-de-moedas
ExchangeRate-API,Free currency conversion,apiKey,Currency Exchange,https://www.exchangerate-api.com
Exchangerate.host,Free foreign exchange & crypto rates API,,Currency Exchange,https://exchangerate.host
Exchangeratesapi.io,Exchange rates with currency conversion,apiKey,Currency Exchange,https://exchangeratesapi.io
Frankfurter,"Exchange rates, currency conversion and time series",,Currency Exchange,https://www.frankfurter.app/docs
FreeForexAPI,Real-time foreign exchange rates for major currency pairs,,Currency Exchange,https://freeforexapi.com/Home/Api
National Bank of Poland,A collection of currency exchange rates (data in XML and JSON),,Currency Exchange,http://api.nbp.pl/en.html
VATComply.com,"Exchange rates, geolocation and VAT number validation",,Currency Exchange,https://www.vatcomply.com/documentation
Lob.com,US Address Verification,apiKey,Data Validation,https://lob.com/
Postman Echo,Test api server to receive and return value from HTTP method,,Data Validation,https://www.postman-echo.com
PurgoMalum,Content validator against profanity & obscenity,,Data Validation,http://www.purgomalum.com
US Autocomplete,Enter address data quickly with real-time address suggestions,apiKey,Data Validation,https://www.smarty.com/docs/cloud/us-autocomplete-pro-api
US Extract,Extract postal addresses from any text including emails,apiKey,Data Validation,https://www.smarty.com/products/apis/us-extract-api
US Street Address,Validate and append data for any US postal address,apiKey,Data Validation,https://www.smarty.com/docs/cloud/us-street-api
vatlayer,VAT number validation,apiKey,Data Validation,https://vatlayer.com/documentation
24 Pull Requests,Project to promote open source collaboration during December,,Development,https://24pullrequests.com/api
Abstract Screenshot,Take programmatic screenshots of web pages from any website,apiKey,Development,https://www.abstractapi.com/website-screenshot-api
Agify.io,Estimates the age from a first name,,Development,https://agify.io
API Grátis,Multiples services and public APIs,,Development,https://apigratis.com.br/
ApicAgent,Extract device details from user-agent string,,Development,https://www.apicagent.com
ApiFlash,Chrome based screenshot API for developers,apiKey,Development,https://apiflash.com/
apilayer userstack,Secure User-Agent String Lookup JSON API,OAuth,Development,https://userstack.com/
APIs.guru,"Wikipedia for Web APIs, OpenAPI/Swagger specs for public APIs",,Development,https://apis.guru/api-doc/
Azure DevOps,The Azure DevOps basic components of a REST API request/response pair,apiKey,Development,https://docs.microsoft.com/en-us/rest/api/azure/devops
Base,Building quick backends,apiKey,Development,https://www.base-api.io/
Beeceptor,Build a mock Rest API endpoint in seconds,,Development,https://beeceptor.com/
Bitbucket,Bitbucket API,OAuth,Development,https://developer.atlassian.com/bitbucket/api/2/reference/
Blague.xyz,La plus grande API de Blagues FR/The biggest FR jokes API,apiKey,Development,https://blague.xyz/
Blitapp,Schedule screenshots of web pages and sync them to your cloud,apiKey,Development,https://blitapp.com/api/
Blynk-Cloud,Control IoT Devices from Blynk IoT Cloud,apiKey,Development,https://blynkapi.docs.apiary.io/#
Bored,Find random activities to fight boredom,,Development,https://www.boredapi.com/
Brainshop.ai,Make A Free A.I Brain,apiKey,Development,https://brainshop.ai/
Browshot,"Easily make screenshots of web pages in any screen size, as any device",apiKey,Development,https://browshot.com/api/documentation
CDNJS,Library info on CDNJS,,Development,https://api.cdnjs.com/libraries/jquery
Changelogs.md,Structured changelog metadata from open source projects,,Development,https://changelogs.md
Ciprand,Secure random string generator,,Development,https://github.com/polarspetroll/ciprand
Cloudflare Trace,"Get IP Address, Timestamp, User Agent, Country Code, IATA, HTTP Version, TLS/SSL Version & More",,Development,https://github.com/fawazahmed0/cloudflare-trace-api
Codex,Online Compiler for Various Languages,,Development,https://github.com/Jaagrav/CodeX
Contentful Images,Used to retrieve and apply transformations to images,apiKey,Development,https://www.contentful.com/developers/docs/references/images-api/
CORS Proxy,Get around the dreaded CORS error by using this proxy as a middle man,,Development,https://github.com/burhanuday/cors-proxy
CountAPI,Free and simple counting service. You can use it to track page hits and specific events,,Development,https://countapi.xyz
Databricks,"Service to manage your databricks account,clusters, notebooks, jobs and workspaces",apiKey,Development,https://docs.databricks.com/dev-tools/api/latest/index.html
DigitalOcean Status,Status of all DigitalOcean services,,Development,https://status.digitalocean.com/api
Docker Hub,Interact with Docker Hub,apiKey,Development,https://docs.docker.com/docker-hub/api/latest/
DomainDb Info,Domain name search to find all domains containing particular words/phrases/etc,,Development,https://api.domainsdb.info/
ExtendsClass JSON Storage,A simple JSON store API,,Development,https://extendsclass.com/json-storage.html
GeekFlare,Provide numerous capabilities for important testing and monitoring methods for websites,apiKey,Development,https://apidocs.geekflare.com/docs/geekflare-api
Genderize.io,Estimates a gender from a first name,,Development,https://genderize.io
GETPing,Trigger an email notification with a simple GET request,apiKey,Development,https://www.getping.info
Ghost,"Get Published content into your Website, App or other embedded media",apiKey,Development,https://ghost.org/
GitHub,"Make use of GitHub repositories, code and user info programmatically",OAuth,Development,https://docs.github.com/en/free-pro-team@latest/rest
Gitlab,Automate GitLab interaction programmatically,OAuth,Development,https://docs.gitlab.com/ee/api/
Gitter,Chat for Developers,OAuth,Development,https://developer.gitter.im/docs/welcome
Glitterly,Image generation API,apiKey,Development,https://developers.glitterly.app
Google Docs,"API to read, write, and format Google Docs documents",OAuth,Development,https://developers.google.com/docs/api/reference/rest
Google Firebase,"Google's mobile application development platform that helps build, improve, and grow app",apiKey,Development,https://firebase.google.com/docs
Google Fonts,Metadata for all families served by Google Fonts,apiKey,Development,https://developers.google.com/fonts/docs/developer_api
Google Keep,"API to read, write, and format Google Keep notes",OAuth,Development,https://developers.google.com/keep/api/reference/rest
Google Sheets,"API to read, write, and format Google Sheets data",OAuth,Development,https://developers.google.com/sheets/api/reference/rest
Google Slides,"API to read, write, and format Google Slides presentations",OAuth,Development,https://developers.google.com/slides/api/reference/rest
Gorest,Online REST API for Testing and Prototyping,OAuth,Development,https://gorest.co.in/
Hasura,GraphQL and REST API Engine with built in Authorization,apiKey,Development,https://hasura.io/opensource/
Heroku,"REST API to programmatically create apps, provision add-ons and perform other task on Heroku",OAuth,Development,https://devcenter.heroku.com/articles/platform-api-reference/
host-t.com,Basic DNS query via HTTP GET request,,Development,https://host-t.com
Host.io,Domains Data API for Developers,apiKey,Development,https://host.io
HTTP2.Pro,Test endpoints for client and server HTTP/2 protocol support,,Development,https://http2.pro/doc/api
Httpbin,A Simple HTTP Request & Response Service,,Development,https://httpbin.org/
Httpbin Cloudflare,A Simple HTTP Request & Response Service with HTTP/3 Support by Cloudflare,,Development,https://cloudflare-quic.com/b/
Hunter,"API for domain search, professional email finder, author finder and email verifier",apiKey,Development,https://hunter.io/api
IBM Text to Speech,Convert text to speech,apiKey,Development,https://cloud.ibm.com/docs/text-to-speech/getting-started.html
Icanhazepoch,Get Epoch time,,Development,https://icanhazepoch.com
Icanhazip,IP Address API,,Development,https://major.io/icanhazip-com-faq/
IFTTT,IFTTT Connect API,,Development,https://platform.ifttt.com/docs/connect_api
Image-Charts,"Generate charts, QR codes and graph images",,Development,https://documentation.image-charts.com/
import.io,Retrieve structured data from a website or RSS feed,apiKey,Development,http://api.docs.import.io/
ip-fast.com,"IP address, country and city",,Development,https://ip-fast.com/docs/
IP2WHOIS Information Lookup,WHOIS domain name lookup,apiKey,Development,https://www.ip2whois.com/
ipfind.io,Geographic location of an IP address or any domain name along with some other useful information,apiKey,Development,https://ipfind.io
IPify,A simple IP Address API,,Development,https://www.ipify.org/
IPinfo,Another simple IP Address API,,Development,https://ipinfo.io/developers
jsDelivr,Package info and download stats on jsDelivr CDN,,Development,https://github.com/jsdelivr/data.jsdelivr.com
JSON 2 JSONP,Convert JSON to JSONP (on-the-fly) for easy cross-domain data requests using client-side JavaScript,,Development,https://json2jsonp.com/
JSONbin.io,"Free JSON storage service. Ideal for small scale Web apps, Websites and Mobile apps",apiKey,Development,https://jsonbin.io
Kroki,Creates diagrams from textual descriptions,,Development,https://kroki.io
License-API,Unofficial REST API for choosealicense.com,,Development,https://github.com/cmccandless/license-api/blob/master/README.md
Logs.to,Generate logs,apiKey,Development,https://logs.to/
Lua Decompiler,Online Lua 5.1 Decompiler,,Development,https://lua-decompiler.ferib.dev/
MAC address vendor lookup,Retrieve vendor details and other information regarding a given MAC address or an OUI,apiKey,Development,https://macaddress.io/api
Micro DB,Simple database service,apiKey,Development,https://m3o.com/db
MicroENV,Fake Rest API for developers,,Development,https://microenv.com/
Mocky,Mock user defined test JSON for REST API endpoints,,Development,https://designer.mocky.io/
MY IP,Get IP address information,,Development,https://www.myip.com/api-docs/
Nationalize.io,Estimate the nationality of a first name,,Development,https://nationalize.io
Netlify,Netlify is a hosting service for the programmable web,OAuth,Development,https://docs.netlify.com/api/get-started/
NetworkCalc,"Network calculators, including subnets, DNS, binary, and security tools",,Development,https://networkcalc.com/api/docs
npm Registry,Query information about your favorite Node.js libraries programatically,,Development,https://github.com/npm/registry/blob/master/docs/REGISTRY-API.md
OneSignal,"Self-serve customer engagement solution for Push Notifications, Email, SMS & In-App",apiKey,Development,https://documentation.onesignal.com/docs/onesignal-api
Open Page Rank,API for calculating and comparing metrics of different websites using Page Rank algorithm,apiKey,Development,https://www.domcop.com/openpagerank/
OpenAPIHub,The All-in-one API Platform,X-Mashape-Key,Development,https://hub.openapihub.com/
OpenGraphr,Really simple API to retrieve Open Graph data from an URL,apiKey,Development,https://opengraphr.com/docs/1.0/overview
oyyi,"API for Fake Data, image/video conversion, optimization, pdf optimization and thumbnail generation",,Development,https://oyyi.xyz/docs/1.0
PageCDN,"Public API for javascript, css and font libraries on PageCDN",apiKey,Development,https://pagecdn.com/docs/public-api
Postman,Tool for testing APIs,apiKey,Development,https://www.postman.com/postman/workspace/postman-public-workspace/documentation/12959542-c8142d51-e97c-46b6-bd77-52bb66712c9a
ProxyCrawl,Scraping and crawling anticaptcha service,apiKey,Development,https://proxycrawl.com
ProxyKingdom,Rotating Proxy API that produces a working proxy on every request,apiKey,Development,https://proxykingdom.com
Pusher Beams,Push notifications for Android & iOS,apiKey,Development,https://pusher.com/beams
QR code,Create an easy to read QR code and URL shortener,,Development,https://www.qrtag.net/api/
QR code,Generate and decode / read QR code graphics,,Development,http://goqr.me/api/
Qrcode Monkey,Integrate custom and unique looking QR codes into your system or workflow,,Development,https://www.qrcode-monkey.com/qr-code-api-with-logo/
QuickChart,Generate chart and graph images,,Development,https://quickchart.io/
Random Stuff,"Can be used to get AI Response, jokes, memes, and much more at lightning-fast speed",apiKey,Development,https://api-docs.pgamerx.com/
Rejax,Reverse AJAX service to notify clients,apiKey,Development,https://rejax.io/
ReqRes,A hosted REST-API ready to respond to your AJAX requests,,Development,https://reqres.in/ 
RSS feed to JSON,Returns RSS feed in JSON format using feed URL,,Development,https://rss-to-json-serverless-api.vercel.app
SavePage.io,"A free, RESTful API used to screenshot any desktop, or mobile website",apiKey,Development,https://www.savepage.io
ScrapeNinja,Scraping API with Chrome fingerprint and residential proxies,apiKey,Development,https://scrapeninja.net
ScraperApi,Easily build scalable web scrapers,apiKey,Development,https://www.scraperapi.com
scraperBox,Undetectable web scraping API,apiKey,Development,https://scraperbox.com/
scrapestack,"Real-time, Scalable Proxy & Web Scraping REST API",apiKey,Development,https://scrapestack.com/
ScrapingAnt,Headless Chrome scraping with a simple API,apiKey,Development,https://scrapingant.com
ScrapingDog,Proxy API for Web scraping,apiKey,Development,https://www.scrapingdog.com/
ScreenshotAPI.net,Create pixel-perfect website screenshots,apiKey,Development,https://screenshotapi.net/
Serialif Color,"Color conversion, complementary, grayscale and contrasted text",,Development,https://color.serialif.com/
serpstack,Real-Time & Accurate Google Search Results API,apiKey,Development,https://serpstack.com/
Sheetsu,Easy google sheets integration,apiKey,Development,https://sheetsu.com/
SHOUTCLOUD,ALL-CAPS AS A SERVICE,,Development,http://shoutcloud.io/
Sonar,Project Sonar DNS Enumeration API,,Development,https://github.com/Cgboal/SonarSearch
SonarQube,"SonarQube REST APIs to detect bugs, code smells & security vulnerabilities",OAuth,Development,https://sonarcloud.io/web_api
StackExchange,Q&A forum for developers,OAuth,Development,https://api.stackexchange.com/
Statically,A free CDN for developers,,Development,https://statically.io/
Supportivekoala,Autogenerate images with template,apiKey,Development,https://developers.supportivekoala.com/
Tyk,Api and service management platform,apiKey,Development,https://tyk.io/open-source/
Wandbox,Code compiler supporting 35+ languages mentioned at wandbox.org,,Development,https://github.com/melpon/wandbox/blob/master/kennel2/API.rst
WebScraping.AI,Web Scraping API with built-in proxies and JS rendering,apiKey,Development,https://webscraping.ai/
ZenRows,"Web Scraping API that bypasses anti-bot solutions while offering JS rendering, and rotating proxies",apiKey,Development,https://www.zenrows.com/
Chinese Character Web,Chinese character definitions and pronunciations,,Dictionaries,http://ccdb.hemiola.com/
Chinese Text Project,Online open-access digital library for pre-modern Chinese texts,,Dictionaries,https://ctext.org/tools/api
Collins,Bilingual Dictionary and Thesaurus Data,apiKey,Dictionaries,https://api.collinsdictionary.com/api/v1/documentation/html/
Free Dictionary,"Definitions, phonetics, pronounciations, parts of speech, examples, synonyms",,Dictionaries,https://dictionaryapi.dev/
Indonesia Dictionary,Indonesia dictionary many words,,Dictionaries,https://new-kbbi-api.herokuapp.com/
Lingua Robot,"Word definitions, pronunciations, synonyms, antonyms and others",apiKey,Dictionaries,https://www.linguarobot.io
Merriam-Webster,Dictionary and Thesaurus Data,apiKey,Dictionaries,https://dictionaryapi.com/
OwlBot,Definitions with example sentence and photo if available,apiKey,Dictionaries,https://owlbot.info/
Oxford,Dictionary Data,apiKey,Dictionaries,https://developer.oxforddictionaries.com/
Synonyms,"Synonyms, thesaurus and antonyms information for any given word",apiKey,Dictionaries,https://www.synonyms.com/synonyms_api.php
Wiktionary,Collaborative dictionary data,,Dictionaries,https://en.wiktionary.org/w/api.php
Wordnik,Dictionary Data,apiKey,Dictionaries,https://developer.wordnik.com
Words,"Definitions and synonyms for more than 150,000 words",apiKey,Dictionaries,https://www.wordsapi.com/docs/
Airtable,Integrate with Airtable,apiKey,Documents & Productivity,https://airtable.com/api
Api2Convert,Online File Conversion API,apiKey,Documents & Productivity,https://www.api2convert.com/
apilayer pdflayer,HTML/URL to PDF,apiKey,Documents & Productivity,https://pdflayer.com
Asana,Programmatic access to all data in your asana system,apiKey,Documents & Productivity,https://developers.asana.com/docs
ClickUp,"ClickUp is a robust, cloud-based project management tool for boosting productivity",OAuth,Documents & Productivity,https://clickup.com/api
Clockify,Clockify's REST-based API can be used to push/pull data to/from it & integrate it with other systems,apiKey,Documents & Productivity,https://clockify.me/developers-api 
CloudConvert,"Online file converter for audio, video, document, ebook, archive, image, spreadsheet, presentation",apiKey,Documents & Productivity,https://cloudconvert.com/api/v2
Cloudmersive Document and Data Conversion,"HTML/URL to PDF/PNG, Office documents to PDF, image conversion",apiKey,Documents & Productivity,https://cloudmersive.com/convert-api
Code::Stats,Automatic time tracking for programmers,apiKey,Documents & Productivity,https://codestats.net/api-docs
CraftMyPDF,Generate PDF documents from templates with a drop-and-drop editor and a simple API,apiKey,Documents & Productivity,https://craftmypdf.com
Flowdash,Automate business workflows,apiKey,Documents & Productivity,https://docs.flowdash.com/docs/api-introduction
Html2PDF,HTML/URL to PDF,apiKey,Documents & Productivity,https://html2pdf.app/
iLovePDF,"Convert, merge, split, extract text and add page numbers for PDFs. Free for 250 documents/month",apiKey,Documents & Productivity,https://developer.ilovepdf.com/
JIRA,JIRA is a proprietary issue tracking product that allows bug tracking and agile project management,OAuth,Documents & Productivity,https://developer.atlassian.com/server/jira/platform/rest-apis/
Mattermost,An open source platform for developer collaboration,OAuth,Documents & Productivity,https://api.mattermost.com/
Mercury,Web parser,apiKey,Documents & Productivity,https://mercury.postlight.com/web-parser/
Monday,Programmatically access and update data inside a monday.com account,apiKey,Documents & Productivity,https://api.developer.monday.com/docs
Notion,Integrate with Notion,OAuth,Documents & Productivity,https://developers.notion.com/docs/getting-started
PandaDoc,DocGen and eSignatures API,apiKey,Documents & Productivity,https://developers.pandadoc.com
Pocket,Bookmarking service,OAuth,Documents & Productivity,https://getpocket.com/developer/
Podio,File sharing and productivity,OAuth,Documents & Productivity,https://developers.podio.com
PrexView,"Data from XML or JSON to PDF, HTML or Image",apiKey,Documents & Productivity,https://prexview.com
Restpack,"Provides screenshot, HTML to PDF and content extraction APIs",apiKey,Documents & Productivity,https://restpack.io/
Todoist,Todo Lists,OAuth,Documents & Productivity,https://developer.todoist.com
Smart Image Enhancement API,Performs image upscaling by adding detail to images through multiple super-resolution algorithms,apiKey,Documents & Productivity,https://apilayer.com/marketplace/image_enhancement-api
Vector Express v2.0,Free vector file converting API,,Documents & Productivity,https://vector.express
WakaTime,Automated time tracking leaderboards for programmers,,Documents & Productivity,https://wakatime.com/developers
Zube,Full stack project management,OAuth,Documents & Productivity,https://zube.io/docs/api
Abstract Email Validation,Validate email addresses for deliverability and spam,apiKey,Email,https://www.abstractapi.com/email-verification-validation-api
apilayer mailboxlayer,Email address validation,apiKey,Email,https://mailboxlayer.com
Cloudmersive Validate,"Validate email addresses, phone numbers, VAT numbers and domain names",apiKey,Email,https://cloudmersive.com/validate-api
Disify,Validate and detect disposable and temporary email addresses,,Email,https://www.disify.com/
DropMail,GraphQL API for creating and managing ephemeral e-mail inboxes,,Email,https://dropmail.me/api/#live-demo
EVA,Validate email addresses,,Email,https://eva.pingutil.com/
Guerrilla Mail,Disposable temporary Email addresses,,Email,https://www.guerrillamail.com/GuerrillaMailAPI.html
ImprovMX,API for free email forwarding service,apiKey,Email,https://improvmx.com/api
Kickbox,Email verification API,,Email,https://open.kickbox.com/
mail.gw,10 Minute Mail,,Email,https://docs.mail.gw
mail.tm,Temporary Email Service,,Email,https://docs.mail.tm
MailboxValidator,Validate email address to improve deliverability,apiKey,Email,https://www.mailboxvalidator.com/api-email-free
MailCheck.ai,Prevent users to sign up with temporary email addresses,,Email,https://www.mailcheck.ai/#documentation
Mailtrap,A service for the safe testing of emails sent from the development and staging environments,apiKey,Email,https://mailtrap.docs.apiary.io/#
Sendgrid,A cloud-based SMTP provider that allows you to send emails without having to maintain email servers,apiKey,Email,https://docs.sendgrid.com/api-reference/
Sendinblue,A service that provides solutions relating to marketing and/or transactional email and/or SMS,apiKey,Email,https://developers.sendinblue.com/docs
Verifier,Verifies that a given email is real,apiKey,Email,https://verifier.meetchopra.com/docs#/
chucknorris.io,JSON API for hand curated Chuck Norris jokes,,Entertainment,https://api.chucknorris.io
Corporate Buzz Words,REST API for Corporate Buzz Words,,Entertainment,https://github.com/sameerkumar18/corporate-bs-generator-api
Excuser,Get random excuses for various situations,,Entertainment,https://excuser.herokuapp.com/
Fun Fact,A simple HTTPS api that can randomly select and return a fact from the FFA database,,Entertainment,https://api.aakhilv.me
Imgflip,Gets an array of popular memes,,Entertainment,https://imgflip.com/api
Meme Maker,REST API for create your own meme,,Entertainment,https://mememaker.github.io/API/
NaMoMemes,Memes on Narendra Modi,,Entertainment,https://github.com/theIYD/NaMoMemes
Random Useless Facts,"Get useless, but true facts",,Entertainment,https://uselessfacts.jsph.pl/
Techy,JSON and Plaintext API for tech-savvy sounding phrases,,Entertainment,https://techy-api.vercel.app/