API,Description,Auth,Category,Linkipgeolocation,IP Geolocation AP with free plan 30k requests per month,apiKey,Geocoding,https://ipgeolocation.io/
IPInfoDB,"Free Geolocation tools and APIs for country, region, city and time zone lookup by IP address",apiKey,Geocoding,https://www.ipinfodb.com/api
Kakao Maps,Kakao Maps provide multiple APIs for Korean maps,apiKey,Geocoding,https://apis.map.kakao.com
keycdn IP Location Finder,Get the IP geolocation data through the simple REST API. All the responses are JSON encoded,apiKey,Geocoding,https://tools.keycdn.com/geo
LocationIQ,Provides forward/reverse geocoding and batch geocoding,apiKey,Geocoding,https://locationiq.org/docs/
Longdo Map,Interactive map with detailed places and information portal in Thailand,apiKey,Geocoding,https://map.longdo.com/docs/
Mapbox,Create/customize beautiful digital maps,apiKey,Geocoding,https://docs.mapbox.com/
MapQuest,To access tools and resources to map the world,apiKey,Geocoding,https://developer.mapquest.com/
Mexico,Mexico RESTful zip codes API,,Geocoding,https://github.com/IcaliaLabs/sepomex
Nominatim,Provides worldwide forward / reverse geocoding,,Geocoding,https://nominatim.org/release-docs/latest/api/Overview/
"One Map, Singapore",Singapore Land Authority REST API services for Singapore addresses,apiKey,Geocoding,https://www.onemap.gov.sg/docs/
OnWater,Determine if a lat/lon is on water or land,,Geocoding,https://onwater.io/
Open Topo Data,Elevation and ocean depth for a latitude and longitude,,Geocoding,https://www.opentopodata.org
OpenCage,Forward and reverse geocoding using open data,apiKey,Geocoding,https://opencagedata.com
openrouteservice.org,"Directions, POIs, isochrones, geocoding (+reverse), elevation, and more",apiKey,Geocoding,https://openrouteservice.org/
OpenStreetMap,"Navigation, geolocation and geographical data",OAuth,Geocoding,http://wiki.openstreetmap.org/wiki/API
Pinball Map,A crowdsourced map of public pinball machines,,Geocoding,https://pinballmap.com/api/v1/docs
positionstack,Forward & Reverse Batch Geocoding REST API,apiKey,Geocoding,https://positionstack.com/
Postali,Mexico Zip Codes API,,Geocoding,https://postali.app/api
PostcodeData.nl,Provide geolocation data based on postcode for Dutch addresses,,Geocoding,http://api.postcodedata.nl/v1/postcode/?postcode=1211EP&streetnumber=60&ref=domeinnaam.nl&type=json
Postcodes.io,Postcode lookup & Geolocation for the UK,,Geocoding,https://postcodes.io
Queimadas INPE,Access to heat focus data (probable wildfire),,Geocoding,https://queimadas.dgi.inpe.br/queimadas/dados-abertos/
REST Countries,Get information about countries via a RESTful API,,Geocoding,https://restcountries.com
RoadGoat Cities,Cities content & photos API,apiKey,Geocoding,https://www.roadgoat.com/business/cities-api
Rwanda Locations,"Rwanda Provences, Districts, Cities, Capital City, Sector, cells, villages and streets",,Geocoding,https://rapidapi.com/victorkarangwa4/api/rwanda
SLF,"German city, country, river, database",,Geocoding,https://github.com/slftool/slftool.github.io/blob/master/API.md
SpotSense,Add location based interactions to your mobile app,apiKey,Geocoding,https://spotsense.io/
Telize,Telize offers location information from any IP address,apiKey,Geocoding,https://rapidapi.com/fcambus/api/telize/
TomTom,"Maps, Directions, Places and Traffic APIs",apiKey,Geocoding,https://developer.tomtom.com/
Uebermaps,Discover and share maps with friends,apiKey,Geocoding,https://uebermaps.com/api/v2
US ZipCode,Validate and append data for any US ZipCode,apiKey,Geocoding,https://www.smarty.com/docs/cloud/us-zipcode-api
Utah AGRC,Utah Web API for geocoding Utah addresses,apiKey,Geocoding,https://api.mapserv.utah.gov
ViaCep,Brazil RESTful zip codes API,,Geocoding,https://viacep.com.br
What3Words,Three words as rememberable and unique coordinates worldwide,apiKey,Geocoding,https://what3words.com
Yandex.Maps Geocoder,Use geocoding to get an object's coordinates from its address,apiKey,Geocoding,https://yandex.com/dev/maps/geocoder
ZipCodeAPI,"US zip code distance, radius and location API",apiKey,Geocoding,https://www.zipcodeapi.com
Zippopotam.us,"Get information about place such as country, city, state, etc",,Geocoding,http://www.zippopotam.us
Ziptastic,"Get the country, state, and city of any US zip-code",,Geocoding,https://ziptasticapi.com/
Bank Negara Malaysia Open Data,Malaysia Central Bank Open Data,,Government,https://apikijangportal.bnm.gov.my/
BCLaws,Access to the laws of British Columbia,,Government,https://www.bclaws.gov.bc.ca/civix/template/complete/api/index.html
Brazil,Community driven API for Brazil Public Data,,Government,https://brasilapi.com.br/
Brazil Central Bank Open Data,Brazil Central Bank Open Data,,Government,https://dadosabertos.bcb.gov.br/
Brazil Receita WS,Consult companies by CNPJ for Brazilian companies,,Government,https://www.receitaws.com.br/
Brazilian Chamber of Deputies Open Data,"Provides legislative information in Apis XML and JSON, as well as files in various formats",,Government,https://dadosabertos.camara.leg.br/swagger/api.html
Census.gov,The US Census Bureau provides various APIs and data sets on demographics and businesses,,Government,https://www.census.gov/data/developers/data-sets.html
"City, Berlin",Berlin(DE) City Open Data,,Government,https://daten.berlin.de/
